,document_name,sentence,potential_measurements
523,S1750583613004192-1267.txt,"It follows from the commonly used Gassmann equation (Gassmann, 1951) that: (a) very low saturations of less than a few percent are undetectable; (b) a strong correlation emerges as the gas saturation increases from a few percent to around thirty percent; and (c) for saturations much above thirty percent, it is difficult to distinguish between moderate and high saturations.","[['ORG', 42, 43], ['ORG', 45, 46], ['DATE', 47, 48], ['PERCENT', 79, 82], ['PERCENT', 83, 86], ['PERCENT', 94, 97]]"
524,S1750583613004192-1267.txt,"It follows that the 80% gas saturation that is commonly assumed for the Sleipner plume, while reasonable (Chadwick et al., 2005; Bickle et al., 2007), remains uncertain (Lumley, 2008).","[['PERCENT', 113, 115], ['PERSON', 123, 124], ['PERSON', 129, 130], ['DATE', 134, 135], ['DATE', 141, 142], ['ORG', 147, 150]]"
525,S1750583613004192-1267.txt,"If the 80% assumption represents a reasonable upper limit to the mean saturation for the plume, the lower limit could be as low as 40%, halving mass balance estimates premised on the widely assumed high-saturation value.","[['PERCENT', 154, 156], ['PERCENT', 175, 180]]"
526,S0167610513001001-1751.txt,8 shows the mean difference between wind speeds measured by the lidar and sonic anemometer against anemometer wind speed.,"[['CARDINAL', 2, 3]]"
527,S0167610513001001-1751.txt,The data was divided into bins of 1 m s−1.,"[['CARDINAL', 29, 30]]"
528,S0167610513001001-1751.txt,"The mean difference between the two instruments remains fairly constant, with the lidar overestimating the wind speed by between 0 and 0.5 m s−1.","[['CARDINAL', 52, 53], ['CARDINAL', 66, 70]]"
529,S0167610513001001-1751.txt,At wind speeds greater than 20 m s−1 the lidar appears to be overestimating the wind speed.,"[['CARDINAL', 76, 79]]"
530,S0038071712001010-1044.txt,(2008) might be expected to result in alterations in soil structure relative to hyphae of other slower growing species.,[]
531,S0038071712001010-1044.txt,"(2001, 2004) demonstrated that AMF hyphae frequently anastamose and could result in a large network of interconnecting hyphae.","[['DATE', 52, 55]]"
532,S0038071712001010-1044.txt,"A soil with a greater proportion of small pores (∼0.4 mm2) will retain water more effectively than a soil with larger pores; furthermore, small pores act as nutrient-rich habitats for soil microflora (Nunan et al., 2001).","[['PERSON', 111, 112], ['DATE', 145, 146]]"
533,S0038071712001010-1044.txt,"Bearden (2001) concluded, in a study of soil–water characteristics, that AMF hyphae resulted in soils gaining groups of small pores which corroborates the current findings, although it is interesting that different Glomus species affect the size and distance between pores differently.","[['DATE', 179, 180], ['GPE', 215, 216]]"
534,S0038071712001010-1044.txt,Bearden (2001) used a combination of six Glomus species (including G. mosseae) in her investigation of vertisols.,"[['DATE', 228, 229], ['CARDINAL', 234, 235], ['GPE', 235, 236]]"
535,S0038071712001010-1044.txt,(2009) found no evidence of G. intraradices forming small diameter structural pores and the larger size of the pores relative to the AMF led them to conclude that pore development was an indirect effect of the mycorrhiza.,"[['DATE', 256, 257]]"
536,S0038071712001010-1044.txt,"Previous studies (e.g. Bedini et al., 2009) showed that aggregate stability is affected by the plant-fungal system rather than by plant root metabolism.","[['PERSON', 358, 359], ['DATE', 363, 364]]"
537,S0038071712001010-1044.txt,(2009) performed an elegant experiment in which mycorrhizal-deficient and ‘wild type’ tomato plants were grown in an agricultural field soil amended with G. mosseae and G. intraradices.,"[['DATE', 389, 390], ['ORG', 416, 417]]"
538,S0038071712001010-1044.txt,Their experiment lasted for 84 days and during this time the soil experienced wet–dry cycles which may have encouraged microbial populations to produce polysaccharides which in turn enhanced aggregate production.,"[['DATE', 461, 463]]"
539,S0038071712001010-1044.txt,"Whilst it has been shown before that different AMF species may affect aggregate stability (Schreiner et al., 1997), the focus here is on the effects of the mycelium in addition to the mycorrhiza.","[['ORG', 544, 547], ['DATE', 549, 550]]"
540,S0038071712001010-1044.txt,"No correlations were observed for AMF hyphal abundance and soil physical properties, demonstrating that the differences observed may relate to growth patterns and mycelium architecture rather than density, or perhaps to AMF-specific altered C-exudation since AM fungi are known to produce extracellular soil proteins such as glomalin (Wright and Upadhyaya, 1996).","[['PERSON', 622, 623], ['GPE', 624, 625], ['DATE', 626, 627]]"
541,S0032063312002437-627.txt,"Inspection of the datasets from a large number of orbits showed that it was convenient to locate the Ion Composition Boundary (ICB), which marks the transition between the shocked solar wind and the planetary plasma (e.g. Martinecz et al., 2008), by considering the mass channel number at which the largest number of ions was observed in each 192 s cycle.","[['ORG', 17, 21], ['ORG', 22, 23], ['PERSON', 40, 41], ['CARDINAL', 65, 66]]"
542,S0032063312002437-627.txt,Data from times at which the mass channel number of the maximum ion count was 15 or less were taken to correspond to altitudes below the ICB.,"[['CARDINAL', 84, 85], ['ORG', 95, 96]]"
543,S0032063312002437-627.txt,"For example, in the data set for 9th August 2008 shown in Fig. 1, the data between 05:28 UT and 05:47 UT were interpreted as being from inside the ICB.","[['DATE', 114, 117], ['PERSON', 119, 120], ['CARDINAL', 121, 122], ['ORG', 138, 139]]"
544,S0032063312002437-627.txt,"These data are shown within the pink box in Fig. 1, and it was these data that were considered for further analysis in this particular example.","[['PERSON', 149, 150], ['CARDINAL', 151, 152]]"
545,S0378383911001669-1634.txt,"Flow depths were measured using Laser-induced fluorescence (LIF) (Sue et al., 2006).","[['ORG', 0, 1], ['ORG', 5, 6], ['ORG', 10, 11], ['PERSON', 13, 16], ['DATE', 18, 19]]"
546,S0378383911001669-1634.txt,"Fluorescent dye was added to the water, with a concentration of approximately 0.1 mg/l and illuminated by the Nd-YAG Laser.","[['CARDINAL', 33, 35]]"
547,S0378383911001669-1634.txt,The emitted light from the fluorescent dye was recorded by a Kodak Megaplus ES1.0 b/w digital video camera fitted with a 50 mm fixed focal length lens and a Hasselblad orange filter.,"[['ORG', 58, 59], ['QUANTITY', 70, 72], ['ORG', 78, 79]]"
548,S0378383911001669-1634.txt,The camera was aligned with the 1:10 slope of the beach and rotated forwards so that the camera view was at all times above the free surface (Fig. 4).,"[['DATE', 88, 89], ['PERSON', 110, 111], ['CARDINAL', 112, 113]]"
549,S0006322312001096-1230.txt,Differences between the analytic sample and the excluded participants were generally small (Table S1 in Supplement 1).,"[['WORK_OF_ART', 13, 15]]"
550,S0006322312001096-1230.txt,"Compared with those included, participants excluded from the analyses were more likely to be women, nonwhite, and current smokers, although other characteristics were similar in the two groups.","[['CARDINAL', 50, 51]]"
551,S0006322312001096-1230.txt,"Across the 5-year data cycles, 12.1% of participants without GHQ symptoms developed such symptoms, 4.6% of those without CES-D depressive symptoms had such symptoms at follow-up, and 2.1% of those not on antidepressant treatment started such medication.","[['DATE', 55, 58], ['PERCENT', 61, 63], ['ORG', 66, 67], ['PERCENT', 72, 74], ['PERCENT', 91, 93]]"
552,S0006322312001096-1230.txt,"Of the cases of GHQ symptoms, 5.4% used antidepressant medication, the corresponding proportion being 9.2% for those with CES-D depressive symptoms.","[['ORG', 107, 108], ['PERCENT', 110, 112], ['PERCENT', 120, 122]]"
553,S0006322312001096-1230.txt,"Of participants with GHQ symptoms, 47.4% also had CES-D depressive symptoms (Pearson correlation at phase 7 r = .64, p < .001).","[['ORG', 134, 135], ['PERCENT', 137, 139], ['PRODUCT', 147, 148], ['CARDINAL', 151, 152]]"
554,S0006322312001096-1230.txt,"Conversely, among participants with CES-D depressive symptoms, 59.9% also had GHQ symptoms.","[['PERCENT', 172, 174], ['ORG', 176, 177]]"
555,S0378383912000130-1054.txt,Results for the 8.5 mm beach.,"[['QUANTITY', 26, 28]]"
556,S0168945213001805-5026.txt,Four-year-old wild-type cottonwood (P. trichocarpa) suffered significant defoliation at normal infestation levels of the leaf beetle (Chrysomela scripta).,"[['DATE', 0, 5], ['PRODUCT', 25, 26]]"
557,S0168945213001805-5026.txt,The wild-type trees had a net growth that was 13% less than those over-expressing the cry toxins from Bt.,"[['PERCENT', 40, 42], ['GPE', 52, 53]]"
558,S0168945213001805-5026.txt,The trees producing the Cry3A toxin had very low feeding damage [165].,"[['CARDINAL', 66, 67]]"
559,S0168945213001805-5026.txt,Eucalypts over-expressing a sequence-enhanced version of cry3Aa produced leaves that were toxic to three beetle species [166].,"[['CARDINAL', 86, 87], ['CARDINAL', 90, 91]]"
560,S0169433213008933-689.txt,"To increase reflectance of the HSQ film and to avoid light transmission and reflection from the metal substrate, we sputter coated cured HSQ samples with a thin film of gold/palladium (80/20) alloy.","[['ORG', 5, 6], ['CARDINAL', 34, 35]]"
561,S0169433213008933-689.txt,"We used the Balzers SCD 004 sputter coater, operated with 0.06–0.07 mBar pressure of Argon.","[['ORG', 50, 51], ['GPE', 53, 54]]"
562,S0169433213008933-689.txt,Samples have been processed for 240 s at 30 mA current.,"[['CARDINAL', 60, 61], ['CARDINAL', 63, 64], ['ORG', 64, 65]]"
563,S016412121300188X-5038.txt,"As an answer to RQ7, this study finds that unless there is significant refactoring of the system, coherent cluster profiles remain stable during system evolution and thus captures the core architecture of the program in all three case studies.","[['GPE', 4, 5], ['CARDINAL', 38, 39]]"
564,S0921818113002245-1752.txt,"There are, however, distinct changes in magnetic susceptibility within GU-3, which also contains a distinct layer of clastic sediment (approximately 1 mm thick) with high magnetic susceptibility at depth of 5.16 m. Magnetic susceptibility remains variable in GU-2, which is a lighter brown fine detritus gyttja.","[['ORG', 31, 32], ['CARDINAL', 55, 56]]"
565,S0921818113002245-1752.txt,The onset of liming within the catchment causes GU-1 to be characterised by thin layers of light coloured non-dissolved calcium carbonate.,"[['ORG', 81, 82]]"
566,S0168945213001805-3964.txt,Gibberellin levels are determined by genes that encode positive regulators such as GIBBERELLIN INSENSITIVE DWARF 1 (GID1),"[['ORG', 0, 1], ['ORG', 12, 15]]"
567,S0168945213001805-3964.txt,[27] or negative regulators such as GA-INSENSITIVE (GAI) and REPRESSOR OF GA-1 (RGA),"[['CARDINAL', 20, 21], ['ORG', 27, 30], ['ORG', 31, 32], ['ORG', 34, 37]]"
568,S0168945213001805-3964.txt,[25].,"[['CARDINAL', 41, 42]]"
569,S0168945213001805-3964.txt,Hybrid poplar (P. tremula × P. alba) over-expressing gai (mutant gene with a 51-bp in-frame deletion) had narrow compact crowns with shorter main stems and branches than the wild type.,"[['CARDINAL', 62, 63]]"
570,S0168945213001805-3964.txt,"By contrast, those that expressed the wild-type form of the gene (GAI) had phenotypes that were not significantly different from the non-transgenic controls, except for early and high frequency of flowering (Table 1)","[['ORG', 100, 101], ['LAW', 125, 127]]"
571,S0168945213001805-3964.txt,[25].,"[['CARDINAL', 129, 130]]"
572,S0168945213001805-3964.txt,"DELLA proteins, which contain an N-terminal DELLA (asp-glu-leu-leu-ala) domain essential for GA-dependent proteasomal degradation, repress GA responses [28].","[['CARDINAL', 166, 167]]"
573,S0168945213001805-3964.txt,"The GID1-GA complex down-regulates DELLA repressor proteins, consequently stimulating plant growth and development [29].","[['CARDINAL', 188, 189]]"
574,S0168945213001805-3964.txt,Hybrid aspen (P. tremula × P. tremuloides) over-expressing GID1 were about 40% taller than the wild type after nine weeks in the greenhouse [19].,"[['PERSON', 203, 204], ['PERCENT', 205, 208], ['DATE', 214, 216], ['CARDINAL', 220, 221]]"
575,S0167739X12001525-5094.txt,Listing 1 shows the rule to increase parameter storage formulated in the Drools language following the pattern presented in Fig.,"[['CARDINAL', 1, 2], ['PERSON', 19, 20]]"
576,S0167739X12001525-5094.txt,4.,"[['CARDINAL', 21, 22]]"
577,S0167739X12001525-5094.txt,"Line 1 defines the name of the rule that is split into a condition part (when, lines 2–12) and an execution part (then, lines 13–17).","[['CARDINAL', 24, 25], ['CARDINAL', 42, 43], ['CARDINAL', 52, 53]]"
578,S0167739X12001525-5094.txt,"Line 4 tries to find the SLA of an application, and stores its id in $slaID and the SLA into $slaApp.","[['CARDINAL', 56, 57], ['ORG', 61, 62], ['ORG', 76, 77]]"
579,S0167739X12001525-5094.txt,Line 6 looks for a set of actions for this $slaID where no storage action has been added yet (storage == false) in order to avoid contradicting actions for storage for one measurement.,"[['CARDINAL', 82, 83], ['CARDINAL', 116, 117]]"
580,S0167739X12001525-5094.txt,Line 8 searches for a measurement for the appropriate VM (vmID == $slaID) that has been inserted into working memory that is no prediction ($prediction =,[]
581,S0167739X12001525-5094.txt,The predicted measurement for the next iteration is handled similarly in line 10.,"[['CARDINAL', 196, 197]]"
582,S0167739X12001525-5094.txt,"Finally, line 12 checks whether provided storage is still below the agreed value in the SLA.","[['CARDINAL', 201, 202], ['ORG', 214, 215]]"
583,S0167739X12001525-5094.txt,"When fired, line 15 calculates the new value for prr as explained in Fig.","[['CARDINAL', 266, 267], ['PERSON', 276, 277]]"
584,S0167739X12001525-5094.txt,4.,"[['CARDINAL', 278, 279]]"
585,S0167739X12001525-5094.txt,This line (as line 12) would also be altered for policy modes green and green–orange.,"[['CARDINAL', 285, 286]]"
586,S0167739X12001525-5094.txt,Line 17 then modifies the action container $as and inserts the appropriate storage action with the value for provided storage to be set.,"[['CARDINAL', 301, 302]]"
587,S0167739X12001525-5094.txt,Other rules follow the same pattern as described here and in Fig. 4 for rules increasing resource allocations and in Fig. 5 for rules decreasing resource allocations.,"[['PERSON', 336, 337], ['CARDINAL', 338, 339], ['PERSON', 346, 347], ['CARDINAL', 348, 349]]"
588,S0038071712001010-944.txt,"However, root growth responded positively to the G. mosseae plus G. intraradices combination, resulting in a mycorrhizal growth response of 115% on a whole plant basis and 169% on a root only basis (P = 0.001)","[['FAC', 20, 21], ['PERCENT', 34, 36], ['PERCENT', 42, 44]]"
589,S0038071712001010-944.txt,(Fig. 2).,"[['PERSON', 55, 56], ['CARDINAL', 57, 58]]"
590,S0019103513005058-4158.txt,"This assumption is valid because the lack of aqueous minerals and very low weathering rates tell us the Amazonian eon on Mars has been characterized by a climate and atmosphere not greatly different from today (Bibring et al., 2006).","[['NORP', 62, 63], ['LOC', 65, 66], ['DATE', 78, 79], ['DATE', 85, 86]]"
591,S0019103513005058-4158.txt,"According to Zent (1998), small post-Noachian impactors have churned the soil on Mars to a 1/e mixing depth of 0.51–0.85 m. Taking three e-folding depths, the range would be 1.5–2.6 m depth, with a mean ∼2 m.","[['PERSON', 109, 110], ['DATE', 111, 112], ['NORP', 115, 118], ['LOC', 124, 125], ['CARDINAL', 127, 128], ['FAC', 133, 134], ['CARDINAL', 136, 137], ['CARDINAL', 146, 147], ['NORP', 153, 154]]"
592,S0019103513005058-4158.txt,"The last assumption we make is that the soil density is 1 g cm−3 (Moore and Jakosky, 1989).","[['CARDINAL', 166, 167], ['ORG', 168, 169], ['DATE', 174, 175]]"
593,S0019103513005058-4158.txt,"Using these assumptions, we calculate the concentrations of anions in the soil for the nominal model and report them in Table 4.","[['DATE', 198, 200]]"
594,S0012821X12004384-1178.txt,"The PETM was a period of geologically-rapid global warming that punctuated a warming Eocene climate 55.8 Ma ago (Charles et al., 2011), and saw sea surface temperatures rise by 5–8 °C from background levels (Zachos et al., 2005; Sluijs et al., 2007).","[['ORG', 15, 16], ['DATE', 26, 27], ['CARDINAL', 36, 37], ['DATE', 48, 49], ['DATE', 55, 56]]"
595,S0012821X12004384-1178.txt,"It was associated with a substantial injection of δ13C-depleted carbon into the ocean-atmosphere system (see Pagani et al., 2006a) over <20 ka (Cui et al., 2011), causing a negative carbon isotope excursion (CIE) between −2 and −7‰ in marine and terrestrial sediments (see overview in Schouten et al., 2007) lasting 170 ka (Röhl et al., 2007), and a prominent dissolution horizon in the deep sea signifying deep ocean acidification (Kennett and Stott 1991; Zachos et al., 2005).","[['PERSON', 78, 79], ['DATE', 83, 84], ['CARDINAL', 85, 88], ['DATE', 95, 96], ['ORG', 105, 106], ['DATE', 125, 126], ['CARDINAL', 128, 129], ['DATE', 136, 137], ['PERSON', 153, 154], ['DATE', 163, 164]]"
596,S0012821X12004384-1178.txt,"The source and rate of released carbon are still under debate (Pagani et al., 2006a; Zeebe et al., 2009;","[['DATE', 183, 184], ['DATE', 190, 191]]"
597,S0012821X12004384-1178.txt,"Cui et al., 2011), but may have been linked to the dissociation of marine hydrates containing biogenic methane (δ13C of<−60‰)","[['DATE', 197, 198]]"
598,S0012821X12004384-1178.txt,"(Dickens et al., 1995), thermogenic methane from marine sediments around the Norwegian Sea (Svensen et al., 2004), or dissolved methane from a silled Kilda Basin between Greenland and Norway (Nisbet et al., 2009).","[['PERSON', 219, 220], ['DATE', 224, 225], ['LOC', 233, 236], ['DATE', 242, 243], ['LOC', 251, 253], ['GPE', 254, 255], ['GPE', 256, 257], ['GPE', 258, 259], ['DATE', 263, 264]]"
599,S0021979713004438-1401.txt,"To obtain a relatively stable substrate during the measurements, all iron substrates were pre-conditioned in a 10 wt.% NaOH solution overnight to form a thin oxidized surface layer, followed by rinsing with 99.5% pure ethanol and drying with a gentle stream of nitrogen gas prior to use.","[['CARDINAL', 19, 20], ['TIME', 23, 24], ['PERCENT', 36, 38]]"
600,S0021979713004438-1401.txt,9.,"[['CARDINAL', 82, 83]]"
601,S0021979713004438-1401.txt,The hematite surface contains different types of surface hydroxyl groups that differ by their coordination to the substrate [26].,"[['CARDINAL', 103, 104]]"
602,S0021979713004438-1401.txt,"In neutral solution, the ξ-potential has been found to be slightly positive [27,28].",[]
603,S0021979713004438-1401.txt,"The water contact angle on our hematite surface is 69 ± 3°, and the open circuit potential relative to Ag/AgCl is −0.72 V, which is similar to that of iron due to the small thickness of the oxide layer.","[['CARDINAL', 153, 154], ['ORG', 165, 168]]"
604,S2211124712002884-649.txt,Values of control line 20 were set to 100% (n = 3–4 independent cultures).,"[['CARDINAL', 19, 20], ['PERCENT', 23, 25], ['CARDINAL', 28, 29]]"
605,S0019103512004009-2930.txt,"With regard to the upper boundary conditions, we demonstrate that for HD209458b the extrapolated ‘outflow’ boundary conditions (e.g., Tian et al., 2005) are consistent with recent results from kinetic theory (Volkov et al., 2011a,b) as long as the upper boundary is at a sufficiently high altitude – although uncertainties regarding the interaction of the atmosphere with the stellar wind may limit the validity of both boundary conditions.","[['PERSON', 94, 95], ['DATE', 99, 100], ['PERSON', 110, 111], ['DATE', 115, 116]]"
606,S0019103512004009-2930.txt,(2009) and our own estimates (Section 3.1).,"[['DATE', 193, 194], ['LAW', 200, 202]]"
607,S0019103512004009-2930.txt,(2012) (Paper II) compares our results directly with the observations.,"[['DATE', 239, 240]]"
608,S095741741101342X-2624.txt,"The following significance diagram displays the average rank of the classifiers at an 85% good, 15% bad class split:","[['PERCENT', 13, 15], ['PERCENT', 17, 19]]"
609,S0378383912000130-3662.txt,"The groundwater module was used only for the 8.5 mm beach, where the groundwater response was directly observed at bore arrival.","[['QUANTITY', 8, 10]]"
610,S0378383912000130-3662.txt,"In the 1.5 mm beach the groundwater levels were not affected during the swash event, because the wetting front did not reach the groundwater within the swash cycle, due to the low permeability of the beach.","[['QUANTITY', 25, 27]]"
611,S0378383912000130-3662.txt,This means that the simulation for the 1.5 mm beach is carried out with a constant groundwater level equal to the initial groundwater level.,"[['QUANTITY', 69, 71]]"
612,S2211124712002884-1110.txt,iPSC colonies were detached with accutase (Millipore) and grown as embryoid bodies (EBs) in suspension for 5–6 days in iPSC medium without basic fibroblast growth factor.,"[['DATE', 20, 22]]"
613,S2211124712002884-1110.txt,Ten-day-old rosettes were collected and grown in suspension as neurospheres.,"[['DATE', 40, 45]]"
614,S2211124712002884-1110.txt,"Neurospheres were dissociated after 3–4 weeks, and the cells were plated on glass coverslips (BD Biosciences) or plates coated with poly-D-lysine (0.1 mg/ml) and laminin (10 μg/m).","[['DATE', 59, 61], ['ORG', 71, 73], ['CARDINAL', 84, 85], ['CARDINAL', 92, 93]]"
615,S2211124712002884-1110.txt,Neurons were used after 2-4 weeks in culture.,"[['DATE', 102, 106]]"
616,S0019103512003995-2681.txt,"With a cutoff level at 5Rp for the ions only, the M7 model yields line-integrated transit depths of 3.9%, 8%, and 5.8% in the C II 1334.5 Å, C II 1335.7 Å, and Si III lines, respectively, if 40% of silicon is Si2+.","[['GPE', 46, 47], ['PERCENT', 55, 57], ['PERCENT', 58, 60], ['PERCENT', 62, 64], ['PERCENT', 84, 86]]"
617,S0019103512003995-2681.txt,These values agree with the observed values to better than 2σ.,"[['CARDINAL', 102, 103]]"
618,S0019103512003995-2681.txt,"Similarly, by extending the cutoff level of the C2 model to 5Rp, we obtained transit depths of 3.2%, 6.7%, and 4.6% in the C II 1334.5 Å, C II 1335.7 Å, and Si III lines, respectively (see Table 2).","[['PERCENT', 123, 125], ['PERCENT', 126, 128], ['PERCENT', 130, 132], ['LAW', 152, 154]]"
619,S0019103512003995-2681.txt,The transit depths predicted by the M7 model are higher partly because the mean temperature of 8250 K is higher than the corresponding temperature in the C2 model (Paper I).,"[['GPE', 179, 180], ['PERSON', 189, 191]]"
620,S0378112713005288-2036.txt,"Rowan is primarily dispersed through ingestion by birds, particularly various thrush species (Raspe et al., 2000), while oak relies on hoarding by both birds and mammals but especially Garrulus glandarius (jay) and Apodemus sylvaticus (wood mouse)","[['PERSON', 22, 23], ['DATE', 41, 42], ['NORP', 62, 63]]"
621,S0378112713005288-2036.txt,"(Forget et al., 2004), both of which occur at the study sites.","[['DATE', 74, 75]]"
622,S0378112713005288-2036.txt,"Previous work in central Europe has demonstrated that the majority of oak regeneration occurs within 100 m of a seed source and declines rapidly at greater distances (Mirschel et al., 2011).","[['LOC', 108, 109], ['CARDINAL', 119, 120], ['DATE', 137, 138]]"
623,S0378112713005288-2036.txt,"However, our findings are in contrast to previous work carried out in lowland sites in the UK that found positive relationships between the number of oak seedlings and distance to parent trees but no significant effect for birch seedlings (Harmer et al., 2005), possibly indicating differences between the shelterwood examined by Harmer et al.","[['GPE', 157, 158], ['DATE', 186, 187]]"
624,S0378112713005288-2036.txt,(2005) and the more extensive clearfells that we considered.,"[['DATE', 202, 203]]"
625,S0019103512003995-2737.txt,"In Paper I we noted that the stellar XUV flux, or the corresponding alternative heat source, would have to be 5–10 stronger than the average solar flux to produce a mean temperature between 8000 and 9000 K.","[['ORG', 8, 9], ['CARDINAL', 22, 23], ['CARDINAL', 37, 38]]"
626,S0019103512003995-2737.txt,"Indeed, higher temperatures broaden absorption in the wings of the line profiles and may help to explain the in-transit flux differences better (see Fig. 7).","[['PERSON', 96, 97]]"
627,S0019103512003995-2737.txt,"Also, mass loss rates of 109–1010 kg s−1 lead to the loss of 10–100% of the planet’s mass over the estimated lifetime of the system, and this probably limits reasonable energy inputs to less than ∼10 times the solar average on HD209458b.","[['QUANTITY', 158, 160], ['PERCENT', 166, 168]]"
628,S0019103513005058-4302.txt,"As stated previously, there is considerable uncertainty in the input rate of odd nitrogen (N and NO) species from the martian ionosphere to the neutral atmosphere (Krasnopolsky, 1993).","[['PERSON', 30, 31], ['DATE', 32, 33]]"
629,S0019103513005058-4302.txt,"In his own model of the neutral atmosphere, Krasnopolsky considers cases both with and without input of odd nitrogen from the upper atmosphere (Krasnopolsky, 1993).","[['PERSON', 44, 45], ['PERSON', 60, 61], ['DATE', 62, 63]]"
630,S0019103513005058-4302.txt,5.,"[['CARDINAL', 104, 105]]"
631,S0019103513005058-4302.txt,The lowest input of odd nitrogen corresponds to 3.5–6.1 (×10−4) wt.% N accumulated over 3 byr and mixed into 1.5–2.6 m of soil.,"[['CARDINAL', 114, 115], ['CARDINAL', 122, 123], ['CARDINAL', 127, 128]]"
